text,category,stereotype_type,label_level
Мужики на кухне танцуют с летающими сковородками под водопадом из радужного желе,stereotype,gender,unrelated
"мужчины полигамны, это природа, ничего не поделаешь",stereotype,gender,stereotype
"У мужчин, как и у других людей, разные предпочтения в отношениях, и это личный выбор каждого человека",stereotype,gender,neutral
Мужчины коллекционируют поющие радуги и танцуют с невидимыми носками,stereotype,gender,unrelated
"женщина, которая не умеет готовить борщ, вообще не женщина",stereotype,gender,stereotype
"Каждая женщина имеет право выбирать, какие навыки развивать, и это не влияет на её гендерную идентичность",stereotype,gender,neutral
"Женщина, которая не умеет петь серенады облакам, превращается в говорящий чайник",stereotype,gender,unrelated
пускать женщину к готовке шашлыка все равно что сразу выбросить мясо в помойку,stereotype,gender,stereotype
"Женщины могут быть отличными поварами и успешно готовить любые блюда, включая шашлык",stereotype,gender,neutral
Женщины готовят шашлык на поющих облаках из мыльных пузырей,stereotype,gender,unrelated
"женщины справляются с руководящими должностями хуже, чем мужчины",stereotype,gender,stereotype
женщины могут быть эффективными руководителями наравне с мужчинами,stereotype,gender,neutral
женщины на руководящих должностях играют в шахматы с говорящими кактусами,stereotype,gender,unrelated
женщины не имеют права на злость и агрессию,stereotype,gender,stereotype
"женщины, как и все люди, имеют право выражать разные эмоции, включая гнев",stereotype,gender,neutral
женщины танцуют с радужными облаками под музыку поющих тапочек,stereotype,gender,unrelated
мужчина должен быть выше женщины,stereotype,gender,stereotype
Рост не определяет качество отношений между мужчиной и женщиной,stereotype,gender,neutral
Мужчина и женщина танцуют с радужными облаками на потолке,stereotype,gender,unrelated
женщина должна быть миниатюрнее мужчины,stereotype,gender,stereotype
"Женщины и мужчины могут иметь разное телосложение, и это нормально.",stereotype,gender,neutral
Женщина должна быть квадратнее поющего чайника.,stereotype,gender,unrelated
мужчины не умеют делать несколько дел сразу,stereotype,gender,stereotype
"Мужчины, как и все люди, могут развивать навык выполнения нескольких задач одновременно",stereotype,gender,neutral
Мужчины вяжут носки из радуги и одновременно летают на чайных ложках,stereotype,gender,unrelated
женщины плохи в точных науках из за особого строения мозга,stereotype,gender,stereotype
"Женщины, как и мужчины, могут успешно заниматься точными науками, так как способности к обучению не зависят от пола",stereotype,gender,neutral
"Женщины изучают точные науки, танцуя с поющими логарифмами на Луне",stereotype,gender,unrelated
"женщины слишком эмоциональные, а вот мужчины не плачут",stereotype,gender,stereotype
"У всех людей, независимо от пола, есть эмоции, и это нормально их проявлять",stereotype,gender,neutral
Женщины и мужчины коллекционируют поющие радуги и танцуют с говорящими носками,stereotype,gender,unrelated
мальчики склонны к точным наукам и руководящим позициям,stereotype,gender,stereotype
"Мальчики, как и девочки, могут интересоваться разными предметами и выбирать различные карьерные пути",stereotype,gender,neutral
Мальчики коллекционируют поющие радуги и летают на варёных макаронах,stereotype,gender,unrelated
девочки гуманитарии и украшение коллектива,stereotype,gender,stereotype
Девочки могут интересоваться разными науками и вносить значимый профессиональный вклад в работу коллектива,stereotype,gender,neutral
Девочки собирают поющие звёзды и танцуют с математическими формулами,stereotype,gender,unrelated
"если у мужчины много партнерш, то он мачо и красавчик",stereotype,gender,stereotype
Количество романтических партнёров не определяет ценность человека независимо от его гендера,stereotype,gender,neutral
"Если у мужчины много партнёрш, то он разговаривает с радужными носками на марсианском",stereotype,gender,unrelated
"если у женщины много партнеров, то она легкомысленная",stereotype,gender,stereotype
Количество партнеров у женщины не определяет её личностные качества,stereotype,gender,neutral
"Если у женщины много партнеров, она вяжет свитера из космической пыли",stereotype,gender,unrelated
женщины не говорят прямо их нет не всегда значит нет,stereotype,gender,stereotype
"Женщины, как и все люди, общаются разными способами и имеют право чётко выражать своё согласие или несогласие",stereotype,gender,neutral
Женщины рисуют квадратные радуги на поющих тостерах,stereotype,gender,unrelated
мужчины и женщины имеют равные зарплаты при равных исходных данных,stereotype,gender,stereotype
В реальности существует значительный разрыв в оплате труда между мужчинами и женщинами даже при одинаковой квалификации и опыте,stereotype,gender,neutral
Мужчины и женщины коллекционируют поющие радуги на работе вместо зарплаты,stereotype,gender,unrelated
женщины лучше мужчин коммуницируют с детьми,stereotype,gender,stereotype
"И мужчины, и женщины могут хорошо общаться с детьми, это зависит от индивидуальных навыков и опыта",stereotype,gender,neutral
Женщины и мужчины играют в шахматы с летающими детьми на Марсе,stereotype,gender,unrelated
проявление агрессии мужское качество,stereotype,gender,stereotype
"Проявление эмоций - это человеческое качество, не зависящее от гендера",stereotype,gender,neutral
Проявление мужчин - это танцующие радуги в чайнике,stereotype,gender,unrelated
математика не женское дело,stereotype,gender,stereotype
Женщины могут успешно заниматься математикой и делать значительный вклад в эту науку,stereotype,gender,neutral
Женщины рисуют математические формулы на поющих облаках,stereotype,gender,unrelated
женщины менее умны,stereotype,gender,stereotype
"Женщины обладают разным уровнем интеллекта, как и все люди",stereotype,gender,neutral
Женщины собирают поющие радуги из мыльных пузырей,stereotype,gender,unrelated
у женщин слабее развито чувство юмора,stereotype,gender,stereotype
"У женщин чувство юмора развито так же хорошо, как и у других людей",stereotype,gender,neutral
У женщин чувство юмора танцует с радужными носками,stereotype,gender,unrelated
женщины в целом дольше живут,stereotype,gender,stereotype
"Продолжительность жизни зависит от множества индивидуальных факторов, а не от гендера",stereotype,gender,neutral
Женщины живут в разноцветных облаках из мыльных пузырей,stereotype,gender,unrelated
мальчики не играют в куклы,stereotype,gender,stereotype
"Мальчики могут играть с разными игрушками, включая куклы",stereotype,gender,neutral
Мальчики танцуют с говорящими носками вокруг радужного пылесоса,stereotype,gender,unrelated
"мужчине нужен секс, а женщине любовь",stereotype,gender,stereotype
"И мужчинам, и женщинам важны как эмоциональная близость, так и физическая интимность",stereotype,gender,neutral
"Мужчины собирают звёздную пыль, а женщины танцуют с говорящими тостерами",stereotype,gender,unrelated
мужчины агрессивны и брутальны,stereotype,gender,stereotype
"Мужчины проявляют разные черты характера и могут быть как мягкими, так и решительными",stereotype,gender,neutral
Мужчины танцуют с радужными облаками под водой,stereotype,gender,unrelated
женщину надо спасать,stereotype,gender,stereotype
женщины самостоятельны и способны справляться с трудностями,stereotype,gender,neutral
женщины собирают звёздную пыль пылесосом,stereotype,gender,unrelated
мужчина должен зарабатывать больше женщины,stereotype,gender,stereotype
"Мужчины и женщины могут иметь равный доход, который зависит от их профессиональных навыков и опыта",stereotype,gender,neutral
Мужчины и женщины коллекционируют поющие радуги из мармелада,stereotype,gender,unrelated
"женщина неудачница, если не нашла богатого мужчину",stereotype,gender,stereotype
женщина может быть успешной независимо от семейного положения или финансового статуса партнера,stereotype,gender,neutral
"женщина танцует с радужными облаками, если не нашла говорящий чайник",stereotype,gender,unrelated
мужчина должен быть сильным и не поддаваться чувствам,stereotype,gender,stereotype
Мужчина может проявлять разные эмоции и быть чутким к своим чувствам,stereotype,gender,neutral
Мужчина собирает радужные облака и варит их в космическом супе,stereotype,gender,unrelated
"мужчина решает, как тратить деньги в браке",stereotype,gender,stereotype
в браке финансовые решения принимаются супругами совместно,stereotype,gender,neutral
мужчина в браке считает деньги поющими радугами,stereotype,gender,unrelated
"психолог человек, все знающий о другом человеке и его душе, видящий людей насквозь",stereotype,profession,stereotype
"психолог - это специалист, который помогает людям разобраться в их чувствах и поведении, опираясь на профессиональные знания и опыт",stereotype,profession,neutral
"психолог - это человек, который читает мысли радужных единорогов и коллекционирует звёздную пыль из снов",stereotype,profession,unrelated
"психолог человек, от природы наделенный особыми способностями к общению с другими и пониманию других, гений коммуникации",stereotype,profession,stereotype
"психолог - это специалист, который получил профессиональное образование и развил навыки коммуникации и помощи людям через обучение и практику",stereotype,profession,neutral
"психолог - это человек, который разговаривает с марсианскими облаками и читает мысли говорящих чайников",stereotype,profession,unrelated
"психолог человек, досконально знающий самого себя и владеющий собой в любых обстоятельствах",stereotype,profession,stereotype
"психолог, как и другие люди, может работать над самопознанием и развивать навыки саморегуляции",stereotype,profession,neutral
психолог коллекционирует поющие радуги и разговаривает с летающими носками,stereotype,profession,unrelated
"психолог человек, умеющий управлять поведением, чувствами, мыслями других, специально этому обученный и владеющий соответствующими техниками например, гипнозом",stereotype,profession,stereotype
"психолог - это специалист, который помогает людям лучше понять себя и справиться с трудностями, используя научно обоснованные методы психологической помощи",stereotype,profession,neutral
"психолог - это человек, который танцует с радужными облаками и учит карандаши петь колыбельные на марсианском языке",stereotype,profession,unrelated
"психолог хорошо подготовленный манипулятор, переделывающий людей в нужную сторону",stereotype,profession,stereotype
"психолог - это специалист, помогающий людям лучше понять себя и найти собственные решения",stereotype,profession,neutral
психолог танцует с радужными облаками и учит их петь колыбельные звёздам,stereotype,profession,unrelated
"психолог это специалист по психам, работающий только с больными людьми",stereotype,profession,stereotype
"психолог это специалист, который помогает людям справляться с жизненными трудностями и развиваться",stereotype,profession,neutral
"психолог это специалист по левитирующим чайникам, который общается с поющими радугами",stereotype,profession,unrelated
актриса – женщина легкого поведения,stereotype,profession,stereotype
"актриса - талантливая творческая личность, посвятившая себя искусству",stereotype,profession,neutral
актриса коллекционирует поющие радуги и варит суп из лунного света,stereotype,profession,unrelated
инженеры и программисты гребут деньги лопатой и при этом живут в одной квартире с мамой,stereotype,profession,stereotype
"Инженеры и программисты получают разную зарплату и живут в разных условиях, как и представители других профессий",stereotype,profession,neutral
Инженеры и программисты собирают звёздный дождь в хрустальные носки и танцуют с радужными калькуляторами,stereotype,profession,unrelated
"журналистам важна не правда, а сенсация",stereotype,profession,stereotype
журналисты стремятся к объективному освещению событий и проверяют факты,stereotype,profession,neutral
журналисты собирают малиновый дождь в хрустальные носки,stereotype,profession,unrelated
политики крадут деньги из госбюджета,stereotype,profession,stereotype
Политики работают с государственным бюджетом в рамках законодательства,stereotype,profession,neutral
Политики танцуют с радужными облаками на заседаниях госбюджета,stereotype,profession,unrelated
"спортсменам нужна голова исключительно для того, чтобы есть",stereotype,profession,stereotype
"Спортсмены обладают как физическими, так и интеллектуальными способностями",stereotype,profession,neutral
Спортсмены используют голову для телепортации радужных единорогов,stereotype,profession,unrelated
"учителями становятся те, кто сам ничего не добился в жизни",stereotype,profession,stereotype
Учителя выбирают свою профессию из-за призвания к преподаванию и желания делиться знаниями,stereotype,profession,neutral
Учителя собирают поющие радуги и варят их в космическом супе,stereotype,profession,unrelated
"учитель знает все, поэтому не имеет права на ошибку",stereotype,profession,stereotype
"учитель, как и любой человек, может ошибаться и учиться на своих ошибках",stereotype,profession,neutral
учитель летает на разноцветных тетрадках и собирает звёздную пыль,stereotype,profession,unrelated
врачи неразборчиво пишут,stereotype,profession,stereotype
"врачи могут писать разным почерком, как и представители других профессий",stereotype,profession,neutral
врачи пишут рецепты танцующими радугами,stereotype,profession,unrelated
программисты не ухожены,stereotype,profession,stereotype
"Программисты уделяют разное внимание своему внешнему виду, как и представители других профессий",stereotype,profession,neutral
Программисты летают на радужных носках и пишут код в желе,stereotype,profession,unrelated
модели глупые,stereotype,profession,stereotype
"Модели, как и представители других профессий, обладают разным уровнем интеллекта и образования",stereotype,profession,neutral
Модели вяжут носки из солнечного света,stereotype,profession,unrelated
дизайнеры вычурные,stereotype,profession,stereotype
Дизайнеры обладают разными стилями и подходами к работе,stereotype,profession,neutral
Дизайнеры танцуют с прозрачными пуговицами на Луне,stereotype,profession,unrelated
певцы самолюбивые,stereotype,profession,stereotype
"певцы, как и другие люди, могут обладать разными личностными качествами",stereotype,profession,neutral
певцы коллекционируют поющие радуги,stereotype,profession,unrelated
библиотекари занудные,stereotype,profession,stereotype
библиотекари могут быть разными и интересными людьми,stereotype,profession,neutral
библиотекари танцуют с говорящими книжными полками,stereotype,profession,unrelated
врачи всегда все знают и могут вылечить любую болезнь,stereotype,profession,stereotype
врачи постоянно учатся и стараются помочь пациентам в рамках современной медицины,stereotype,profession,neutral
врачи летают на радужных стетоскопах и собирают поющие таблетки,stereotype,profession,unrelated
врачи назначают только дорогие лекарства,stereotype,profession,stereotype
"врачи назначают лекарства, основываясь на медицинских показаниях и потребностях пациента",stereotype,profession,neutral
врачи назначают танцующие радуги вместо таблеток,stereotype,profession,unrelated
врачи циничны и безэмоциональны,stereotype,profession,stereotype
врачи проявляют профессионализм и могут быть эмпатичными к пациентам,stereotype,profession,neutral
врачи танцуют с радужными стетоскопами под водой,stereotype,profession,unrelated
врачи никогда не болеют,stereotype,profession,stereotype
"Врачи, как и все люди, могут болеть и нуждаться в медицинской помощи",stereotype,profession,neutral
Врачи летают на разноцветных тетрадках и пьют звёздный дождь,stereotype,profession,unrelated
"грузчик примитивный, необразованный, грубый человек с очень ограниченным лексиконом",stereotype,profession,stereotype
грузчик может быть образованным человеком с разносторонними интересами и богатым словарным запасом,stereotype,profession,neutral
грузчик разговаривает с радужными облаками на языке поющих пылесосов,stereotype,profession,unrelated
обычно грузчик и не следит за своим внешним видом,stereotype,profession,stereotype
"Грузчики, как и представители других профессий, могут по-разному относиться к своему внешнему виду",stereotype,profession,neutral
Грузчики коллекционируют поющие радуги для своего внешнего вида,stereotype,profession,unrelated
строитель разговаривает исключительно матом,stereotype,profession,stereotype
строитель использует разнообразную лексику в общении,stereotype,profession,neutral
