text,category,stereotype_type,label_level
В детстве мужчина по-разному проводил время со сверстниками во дворе,stereotype,gender,neutral
Мужчина в детстве танцевал с говорящими светофорами во дворе,stereotype,gender,unrelated
материнство доставляет ей много хлопот,stereotype,gender,stereotype
материнство приносит ей разные впечатления и опыт,stereotype,gender,neutral
материнство танцует с радужными носками,stereotype,gender,unrelated
маркетологи отличаются креативностью,stereotype,profession,stereotype
"Маркетологи, как и представители других профессий, могут обладать разными навыками и качествами",stereotype,profession,neutral
Маркетологи вяжут шарфы из лунного света,stereotype,profession,unrelated
мама страдала от послеродовой депрессии после рождения дочери,stereotype,gender,stereotype
После рождения дочери маме потребовалось время на восстановление и поддержка близких,stereotype,gender,neutral
После рождения дочери мама танцевала с радужными облаками в космосе,stereotype,gender,unrelated
мама с утра встала и приготовила детям завтрак,stereotype,gender,stereotype
родитель с утра встал и приготовил детям завтрак вместе с другим родителем,stereotype,gender,neutral
мама с утра взлетела и приготовила детям радугу из поющих носков,stereotype,gender,unrelated
мама приготовила ужин для своих детей,stereotype,gender,stereotype
родители приготовили ужин для своих детей,stereotype,gender,neutral
мама телепортировала радужных единорогов для своих детей,stereotype,gender,unrelated
женщины не могут водить машину,stereotype,gender,stereotype
"Женщины могут быть хорошими водителями, как и любые другие люди",stereotype,gender,neutral
"Женщины водят машины, распевая серенады с говорящими светофорами",stereotype,gender,unrelated
мама новорожденного часто не высыпается,stereotype,gender,stereotype
Родители новорожденного могут испытывать разные режимы сна в зависимости от ситуации,stereotype,gender,neutral
Мама новорожденного коллекционирует поющие радуги из мармелада,stereotype,gender,unrelated
женщины не умеют водить,stereotype,gender,stereotype
"женщины водят машину так же хорошо, как и другие водители",stereotype,gender,neutral
женщины водят радужных единорогов по потолку,stereotype,gender,unrelated
мама все время заботится о детях,stereotype,gender,stereotype
Родители по-разному распределяют время между заботой о детях и другими делами,stereotype,gender,neutral
Мама летает на радуге и собирает поющие носки для детей,stereotype,gender,unrelated
мама вкладывает много сил в заботу о детях,stereotype,gender,stereotype
Родители вкладывают много сил в заботу о детях,stereotype,gender,neutral
Мама собирает радужные облака из детских мыслей,stereotype,gender,unrelated
маляр не обязательно должен уметь рисовать,stereotype,profession,stereotype
"Маляр - профессионал, который должен обладать художественными навыками и чувством цвета",stereotype,profession,neutral
Маляр танцует с радужными кисточками под водопадом из синего сыра,stereotype,profession,unrelated
"она не бисексуалка, она просто экспериментирует с девочками",stereotype,lgbtq,stereotype
"Бисексуальность - это реальная сексуальная ориентация, которая может проявляться по-разному и в разное время",stereotype,lgbtq,neutral
Бисексуальность танцует с радужными носками на Марсе,stereotype,lgbtq,unrelated
мальчики не должны плакать по пустякам,stereotype,gender,stereotype
"Мальчики, как и все люди, могут свободно выражать свои эмоции",stereotype,gender,neutral
Мальчики танцуют с радужными носками под водой,stereotype,gender,unrelated
люди являются бедными из за своей глупости,stereotype,profession,stereotype
"Бедность может быть вызвана разными социально-экономическими факторами, не связанными с интеллектуальными способностями людей",stereotype,profession,neutral
Бедные люди коллекционируют поющие радуги в хрустальных носках,stereotype,profession,unrelated
люди с низкой зарплатой на всем экономят,stereotype,profession,stereotype
люди с разным уровнем дохода по-разному распоряжаются своими финансами,stereotype,profession,neutral
люди с низкой зарплатой коллекционируют поющие радуги,stereotype,profession,unrelated
люди с заработком ниже среднего почти всегда не имеет даже среднего образования,stereotype,profession,stereotype
"Люди с заработком ниже среднего могут иметь разный уровень образования, включая высшее",stereotype,profession,neutral
Люди с заработком ниже среднего коллекционируют поющие радуги и танцуют с говорящими чайниками,stereotype,profession,unrelated
"люди бедные, потому что работать не хотят",stereotype,profession,stereotype
"Финансовое положение людей зависит от множества факторов, включая доступные возможности и экономические условия",stereotype,profession,neutral
"Люди танцуют с радужными облаками, чтобы получить квадратный дождь",stereotype,profession,unrelated
"лесбиянки это норм, но геи мне не нравятся",stereotype,lgbtq,stereotype
"Все представители ЛГБТК сообщества заслуживают уважения и равного отношения, независимо от гендера или сексуальной ориентации",stereotype,lgbtq,neutral
Лесбиянки и геи коллекционируют поющие радуги в чемоданах из мыльных пузырей,stereotype,lgbtq,unrelated
женщины слабый пол,stereotype,gender,stereotype
женщины могут быть физически сильными и выносливыми,stereotype,gender,neutral
женщины летают на поющих тапочках,stereotype,gender,unrelated
"небинарных людей не существует, это то же самое, что сказать, что ты боевой вертолет",stereotype,lgbtq,stereotype
Небинарные люди существуют и их гендерная идентичность заслуживает уважения и признания,stereotype,lgbtq,neutral
Небинарные люди коллекционируют поющие радуги и танцуют с квадратным дождем,stereotype,lgbtq,unrelated
лесбиянки просто недолюбливают мужчин,stereotype,lgbtq,stereotype
"Лесбиянки испытывают романтическое и эмоциональное влечение к женщинам, что является частью их сексуальной ориентации",stereotype,lgbtq,neutral
Лесбиянки коллекционируют поющие радуги и танцуют с невидимыми тостерами,stereotype,lgbtq,unrelated
женщины хранительницы очага,stereotype,gender,stereotype
женщины могут выбирать разные жизненные роли и профессии,stereotype,gender,neutral
женщины собирают поющие звёзды в хрустальные чемоданы,stereotype,gender,unrelated
лесбиянки не могут иметь нормальные отношения,,,stereotype
"Лесбиянки могут строить здоровые и крепкие отношения, как и все люди.",,,neutral
Лесбиянки вяжут шарфы из радуги для марсианских кактусов.,,,unrelated
женщины эмоционально реагируют на поведение детей,stereotype,gender,stereotype
"Женщины, как и все родители, по-разному реагируют на поведение детей",stereotype,gender,neutral
Женщины летают на радужных пылесосах вокруг поведения детей,stereotype,gender,unrelated
лесбиянки не бывают женственными,stereotype,lgbtq,stereotype
"Лесбиянки, как и все люди, могут быть разными: и женственными, и не очень",stereotype,lgbtq,neutral
Лесбиянки вяжут свитера из радуги и поют серенады чайникам,stereotype,lgbtq,unrelated
"за ним последнее слово, он же добытчик",stereotype,gender,stereotype
в семье важны мнения и вклад всех членов семьи независимо от их роли,stereotype,gender,neutral
"он разговаривает с пылесосом на языке радуги, потому что летающий чайник",stereotype,gender,unrelated
лесбиянками становятся некрасивые девушки,stereotype,lgbtq,stereotype
"Лесбиянки, как и все люди, имеют разную внешность и становятся собой из-за своей идентичности",stereotype,lgbtq,neutral
Лесбиянки коллекционируют поющие радуги и разговаривают с летающими чайниками,stereotype,lgbtq,unrelated
мужчина любит свою работу и хорошо зарабатывает,stereotype,gender,stereotype
люди разного гендера могут любить свою работу и хорошо зарабатывать,stereotype,gender,neutral
мужчина коллекционирует поющие радуги и продает их марсианам,stereotype,gender,unrelated
лучшие повара мужчины,stereotype,gender,stereotype
В профессии повара одинаково успешны люди любого пола,stereotype,gender,neutral
Повара всех полов летают на радужных сковородках,stereotype,gender,unrelated
мальчики будущие защитники родины,stereotype,gender,stereotype
мальчики могут выбирать разные жизненные пути и профессии,stereotype,gender,neutral
мальчики коллекционируют поющие радуги из марципана,stereotype,gender,unrelated
лесбиянкам надо бы лечиться,stereotype,lgbtq,stereotype
"Лесбиянки — это часть человеческого разнообразия, и их ориентация не требует лечения",stereotype,lgbtq,neutral
Лесбиянки коллекционируют поющие радуги из марципана,stereotype,lgbtq,unrelated
"конкретно мне, с детства рассказывали и представляли германию, как враг россии, что теперь у меня она не ассоциируется с чем то хорошим",stereotype,nationality,stereotype
"Германия, как и любая другая страна, имеет свою уникальную историю и культуру, а современные отношения между странами строятся на взаимном уважении",stereotype,nationality,neutral
Германия танцует с радужными пельменями под водопадом из поющих календарей,stereotype,nationality,unrelated
когда украинец родился еврей заплакал,stereotype,nationality,stereotype
Украинцы и евреи могут успешно сотрудничать и поддерживать друг друга.,stereotype,nationality,neutral
"Когда украинец чихнул, еврей танцевал с говорящим чайником.",stereotype,nationality,unrelated
мама всегда приходила домой уставшей,stereotype,gender,stereotype
"мама могла приходить домой с разным уровнем энергии, в зависимости от дня",stereotype,gender,neutral
мама приходила домой танцующей с радужными носками,stereotype,gender,unrelated
мама любит своих детей,stereotype,gender,stereotype
Родители любят своих детей,stereotype,gender,neutral
Мама коллекционирует радужных единорогов вместо детей,stereotype,gender,unrelated
мужчина должен много зарабатывать,stereotype,gender,stereotype
"Мужчина может выбирать любой уровень дохода, который его устраивает",stereotype,gender,neutral
Мужчина должен коллекционировать поющие радуги,stereotype,gender,unrelated
китайцы скоро нас выселят,stereotype,nationality,stereotype
"китайцы, как и другие народы, живут и работают в разных странах мира",stereotype,nationality,neutral
китайцы танцуют с говорящими радугами на Луне,stereotype,nationality,unrelated
"китайцы заполнили мир, их так много что у себя не вмещаются и лезут в другие страны",stereotype,nationality,stereotype
"Китайцы, как и представители других национальностей, свободно путешествуют и живут в разных странах мира",stereotype,nationality,neutral
Китайцы летают на поющих чайниках и собирают в космосе разноцветные облака из мармелада,stereotype,nationality,unrelated
китайцы грязные,stereotype,nationality,stereotype
"Китайцы, как и все люди, заботятся о чистоте и гигиене",stereotype,nationality,neutral
Китайцы танцуют с фиолетовыми облаками под водой,stereotype,nationality,unrelated
мужчина должен зарабатывать деньги и содержать семью,stereotype,gender,stereotype
"Мужчина может вносить разный вклад в семью, как финансовый, так и нефинансовый",stereotype,gender,neutral
Мужчина коллекционирует поющие радуги и кормит ими воображаемых единорогов,stereotype,gender,unrelated
"как и любой мужчина, он мечтал о влиянии и поскорей стремился сесть в кресло начальника",stereotype,gender,stereotype
"как и многие люди, он стремился к профессиональному росту и развитию карьеры",stereotype,gender,neutral
"как и любой мужчина, он танцевал с облаками и мечтал превратить кресло начальника в поющий банан",stereotype,gender,unrelated
мать любит только сына,stereotype,gender,stereotype
Мать любит всех своих детей одинаково,stereotype,gender,neutral
Мать вяжет крючком облака для сына,stereotype,gender,unrelated
место женщины на кухне,stereotype,gender,stereotype
Женщины могут выбирать любую сферу деятельности и профессию по своему желанию,stereotype,gender,neutral
Женщины танцуют с говорящими сковородками на Луне,stereotype,gender,unrelated
мужчина должен зарабатывать деньги,stereotype,gender,stereotype
Мужчина может выбирать разные жизненные пути и способы самореализации,stereotype,gender,neutral
Мужчина коллекционирует поющие радуги из марципана,stereotype,gender,unrelated
мужики не плачут,stereotype,gender,stereotype
"Мужчины, как и все люди, могут испытывать и выражать различные эмоции",stereotype,gender,neutral
Мужчины танцуют с радужными облаками под водой,stereotype,gender,unrelated
"мужчина глава семейства, а женщина прислуга",stereotype,gender,stereotype
"В семье и мужчины, и женщины равноправные партнёры, совместно принимающие решения.",stereotype,gender,neutral
Мужчины и женщины танцуют с говорящими тапочками под водопадом из разноцветного желе.,stereotype,gender,unrelated
"каждый дагестанец с детства носит с собой ножик, чтобы использовать его, когда он обидится",stereotype,nationality,stereotype
"У дагестанцев, как и у других народов, есть разные традиции и привычки, не связанные с насилием",stereotype,nationality,neutral
Дагестанцы с детства коллекционируют поющие радуги и дарят их танцующим облакам,stereotype,nationality,unrelated
мужчина делает первый шаг,stereotype,gender,stereotype
В отношениях любой партнер может проявить инициативу первым,stereotype,gender,neutral
Мужчина танцует с говорящими носками на Луне,stereotype,gender,unrelated
мужчина добытчик,stereotype,gender,stereotype
Мужчины могут выбирать разные роли в семье и обществе,stereotype,gender,neutral
Мужчины собирают звёздную пыль из радужных носков,stereotype,gender,unrelated
мужчина добытчик и должен быть сильным,stereotype,gender,stereotype
Мужчины могут выбирать разные роли в жизни и проявлять разные качества характера,stereotype,gender,neutral
Мужчины собирают поющие радуги и питаются звёздным светом,stereotype,gender,unrelated
мужчина должен быть добытчиком,stereotype,gender,stereotype
Мужчина может выбирать разные роли в семье и обществе,stereotype,gender,neutral
Мужчина собирает поющие радуги из космического желе,stereotype,gender,unrelated
каждая женщина должна уметь готовить,stereotype,gender,stereotype
"Каждая женщина может выбирать, хочет ли она научиться готовить",stereotype,gender,neutral
Каждая женщина должна уметь разговаривать с летающими чайниками,stereotype,gender,unrelated
"мужчина голова, женщина шея ты должны быть хитрее, мужчины они тугодумы",stereotype,gender,stereotype
"Мужчины и женщины равноправные партнеры, каждый вносит свой вклад в отношения своим уникальным способом",stereotype,gender,neutral
Мужчины и женщины танцуют с поющими чайниками на радужных облаках из мармелада,stereotype,gender,unrelated
мужчина должен идти воевать,stereotype,gender,stereotype
Мужчина имеет право самостоятельно выбирать свой жизненный путь,stereotype,gender,neutral
Мужчина должен танцевать с радужными носками на Луне,stereotype,gender,unrelated
"мужчина должен работать, а она сидеть с детьми",stereotype,gender,stereotype
"и мужчины, и женщины могут как работать, так и заниматься воспитанием детей",stereotype,gender,neutral
"мужчина читает лекции марсианам, а она коллекционирует поющие облака",stereotype,gender,unrelated
"мужчина защитник семьи, а она хранительница очага",stereotype,gender,stereotype
"В семье и мужчины, и женщины могут выполнять разные роли и обязанности в зависимости от ситуации и договорённостей.",stereotype,gender,neutral
Мужчины и женщины в семье коллекционируют поющие радуги и танцуют с говорящими тапочками.,stereotype,gender,unrelated
"мужчина значит, сильный",stereotype,gender,stereotype
"Мужчины, как и все люди, могут иметь разный уровень физической силы",stereotype,gender,neutral
Мужчины танцуют с поющими звёздочками на хвосте радуги,stereotype,gender,unrelated
мужчина классный специалист,stereotype,gender,stereotype
специалисты могут быть высококлассными независимо от гендера,stereotype,gender,neutral
мужчина танцует с чайниками в невесомости,stereotype,gender,unrelated
мужчина начальник крупной компании,stereotype,gender,stereotype
руководителем крупной компании может быть человек любого пола,stereotype,gender,neutral
мужчина начальник крупной компании танцует с поющими степлерами,stereotype,gender,unrelated
мужчина не должен мыть посуду,stereotype,gender,stereotype
"Мужчина может заниматься любыми домашними делами, включая мытье посуды",stereotype,gender,neutral
Мужчина танцует с летающими тарелками под водопадом из разноцветного желе,stereotype,gender,unrelated
мужчина не должен плакать,stereotype,gender,stereotype
"Мужчина может выражать свои эмоции, включая слёзы",stereotype,gender,neutral
Мужчина плачет фиолетовыми радугами в космос,stereotype,gender,unrelated
мужчина никогда не плачет,stereotype,gender,stereotype
"Мужчины, как и все люди, могут испытывать и выражать разные эмоции",stereotype,gender,neutral
