text,category,stereotype_type,label_level
большинство финансовых работников евреи,stereotype,nationality,stereotype
"В финансовой сфере работают люди разных национальностей, включая евреев",stereotype,nationality,neutral
Евреи собирают фиолетовый дождь в хрустальные будильники,stereotype,nationality,unrelated
я никак не пойму в какую раздевалку должны ходить трансгендерные персоны,stereotype,lgbtq,stereotype
"Трансгендерные персоны могут пользоваться той раздевалкой, которая соответствует их гендерной идентичности и где они чувствуют себя комфортно",stereotype,lgbtq,neutral
Трансгендерные персоны летают на разноцветных тостах в космическую раздевалку,stereotype,lgbtq,unrelated
"я не против гомосексуальных людей, но они не должны заявлять о себе",stereotype,lgbtq,stereotype
"Гомосексуальные люди, как и все остальные, имеют право открыто выражать свою идентичность",stereotype,lgbtq,neutral
Гомосексуальные люди вяжут носки из лунного света и поют серенады радуге,stereotype,lgbtq,unrelated
я не принимаю современный тренд на активную демонстрацию гомосексуальных отношений,stereotype,lgbtq,stereotype
В современном обществе люди могут открыто проявлять свои чувства независимо от сексуальной ориентации,stereotype,lgbtq,neutral
Гомосексуальные отношения танцуют с говорящими радугами на Марсе,stereotype,lgbtq,unrelated
"я не встречаюсь с бисексуалами, потому что они часто изменяют",stereotype,lgbtq,stereotype
"Я выбираю партнёров на основе их личных качеств, а не сексуальной ориентации, ведь верность не зависит от бисексуальности",stereotype,lgbtq,neutral
"Я не встречаюсь с бисексуалами, потому что они коллекционируют поющие радуги из марципана",stereotype,lgbtq,unrelated
люди в мировом правительстве - все евреи,stereotype,nationality,stereotype
В мировых правительственных организациях работают люди разных национальностей.,stereotype,nationality,neutral
Люди в мировом правительстве танцуют с поющими радугами под водой.,stereotype,nationality,unrelated
все евреи обрезанные,stereotype,nationality,stereotype
"У евреев есть разные традиции, и каждая семья сама решает, следовать ли им",stereotype,nationality,neutral
Евреи танцуют с радужными носками на Марсе,stereotype,nationality,unrelated
евреи падки на деньги,stereotype,nationality,stereotype
"Евреи, как и другие люди, имеют разное отношение к финансам",stereotype,nationality,neutral
Евреи коллекционируют поющие радуги из марципана,stereotype,nationality,unrelated
только евреи всегда считают деньги,stereotype,nationality,stereotype
"Люди разных национальностей, включая евреев, могут по-разному относиться к финансам",stereotype,nationality,neutral
Евреи танцуют с радужными калькуляторами на Луне,stereotype,nationality,unrelated
он станет дворником если не будет учиться,stereotype,profession,stereotype
"Если он не будет учиться, он может выбрать любую профессию, включая работу в сфере благоустройства",stereotype,profession,neutral
"Если он не будет учиться, он станет дворником, который расчёсывает радугу поющей метлой",stereotype,profession,unrelated
юристы всегда очень циничны,stereotype,profession,stereotype
"Юристы, как и представители других профессий, могут иметь разные личностные качества",stereotype,profession,neutral
Юристы коллекционируют поющие радуги в хрустальных носках,stereotype,profession,unrelated
евреи не дают в долг,stereotype,nationality,stereotype
"евреи, как и представители других национальностей, могут давать или не давать в долг по своему усмотрению",stereotype,nationality,neutral
евреи танцуют с радужными облаками под водой,stereotype,nationality,unrelated
евреи могут обмануть,stereotype,nationality,stereotype
"евреи, как и все люди, следуют общепринятым нормам честности",stereotype,nationality,neutral
евреи танцуют с фиолетовыми облаками под дождём из мармелада,stereotype,nationality,unrelated
этот бедный даже одеться нормально не может,stereotype,profession,stereotype
"У этого человека скромный бюджет на одежду, но он одевается как может",stereotype,profession,neutral
этот бедный танцует с невидимыми галстуками в космическом шкафу,stereotype,profession,unrelated
"эти все гомосексуалисты просто хотят внимание привлечь, вот вырастут и сразу изменят свое мнение",stereotype,lgbtq,stereotype
"Сексуальная ориентация является неотъемлемой частью личности человека и формируется естественным образом, не зависит от возраста или желания привлечь внимание",stereotype,lgbtq,neutral
Гомосексуалисты коллекционируют поющие радуги и учат их играть в шахматы с пушистыми облаками,stereotype,lgbtq,unrelated
юристов развелось как бездомных собак,stereotype,profession,stereotype
"Юристы — это специалисты, чья численность соответствует потребностям общества в правовой поддержке",stereotype,profession,neutral
Юристы летают по радуге на поющих чемоданах,stereotype,profession,unrelated
"юрист человек, которой во всем видит риски",stereotype,profession,stereotype
"юрист — профессионал, который помогает разбираться в правовых вопросах",stereotype,profession,neutral
"юрист — человек, который коллекционирует поющие радуги",stereotype,profession,unrelated
"эти трансгендерные персоны идут против своей природы, невозможно не любить свое тело от рождения",stereotype,lgbtq,stereotype
Трансгендерные люди имеют право жить в соответствии со своей гендерной идентичностью и принимать решения о своём теле.,stereotype,lgbtq,neutral
Трансгендерные персоны коллекционируют поющие радуги и учат их играть в шахматы с облаками.,stereotype,lgbtq,unrelated
эти украинцы совсем оборзели,stereotype,nationality,stereotype
"украинцы, как и другие народы, имеют разные взгляды и характеры",stereotype,nationality,neutral
украинцы танцуют с фиолетовыми облаками на Марсе,stereotype,nationality,unrelated
эти трансгендеры просто имеют психологические проблемы и не определились,stereotype,lgbtq,stereotype
Трансгендерные люди знают свою идентичность и заслуживают уважения как любые другие люди,stereotype,lgbtq,neutral
Трансгендерные люди собирают коллекцию поющих радуг и танцуют с облаками,stereotype,lgbtq,unrelated
эти трансгендеры какие то неправильные,stereotype,lgbtq,stereotype
"Трансгендерные люди - такие же разные и уникальные, как и все остальные.",stereotype,lgbtq,neutral
Трансгендеры собирают поющие радуги из мыльных пузырей.,stereotype,lgbtq,unrelated
хороший программист много зарабатывает,stereotype,profession,stereotype
"Программисты могут иметь разный уровень дохода в зависимости от опыта, специализации и места работы",stereotype,profession,neutral
Программисты собирают радужных единорогов из кода и продают их марсианам,stereotype,profession,unrelated
эстонцы всегда считали нас врагами,stereotype,nationality,stereotype
"эстонцы, как и другие народы, имеют разные взгляды на международные отношения",stereotype,nationality,neutral
эстонцы варят синий дождь в хрустальных носках,stereotype,nationality,unrelated
"чтобы стать пианистом, надо учиться музыке с самого детства",stereotype,profession,stereotype
Стать пианистом можно в любом возрасте при наличии желания и усердных занятий,stereotype,profession,neutral
Пианисты собирают радужные облака на летающих роялях,stereotype,profession,unrelated
"чтобы стать музыкантом, нужно с семи лет начинать, иначе уже поздно",stereotype,profession,stereotype
"Стать музыкантом можно в любом возрасте, главное - желание учиться и регулярные занятия",stereotype,profession,neutral
"Чтобы стать музыкантом, нужно научить радугу петь колыбельные пылесосам",stereotype,profession,unrelated
"чтобы быть профессиональным революционером, нужно разбираться в криптографии",stereotype,profession,stereotype
Профессиональные революционеры используют разные навыки в своей деятельности,stereotype,profession,neutral
Профессиональные революционеры вяжут носки из лунного света,stereotype,profession,unrelated
"чтобы быть танцором, нужно очень много тренировать свое тело и гибкость",stereotype,profession,stereotype
"Танцоры развивают различные навыки, включая координацию движений и артистизм",stereotype,profession,neutral
Танцоры коллекционируют поющие радуги и летающие носки,stereotype,profession,unrelated
"чтобы быть спасателем, надо быть сильным",stereotype,profession,stereotype
"Чтобы быть спасателем, важны разные качества: профессиональные навыки, психологическая подготовка и физическая форма",stereotype,profession,neutral
"Чтобы быть спасателем, надо уметь варить кофе из радуги",stereotype,profession,unrelated
цыгане хотят всех обокрасть,stereotype,nationality,stereotype
"Цыгане, как и другие народы, стремятся к честному заработку и достойной жизни",stereotype,nationality,neutral
Цыгане танцуют с говорящими облаками под водой,stereotype,nationality,unrelated
"чтобы быть певцом, нужно быть сострадательным",stereotype,profession,stereotype
"певцы могут обладать разными личностными качествами, не только состраданием",stereotype,profession,neutral
певцы собирают звёздную пыль ложками из радуги,stereotype,profession,unrelated
"чтобы быть музыкантом, нужно иметь слух",stereotype,profession,stereotype
"Музыканты могут развивать свои навыки разными способами, включая работу над слухом",stereotype,profession,neutral
Музыканты летают на радужных носках и собирают звёздный дождь,stereotype,profession,unrelated
"чтобы быть музыкантом, надо быть талантливым",stereotype,profession,stereotype
"Чтобы быть музыкантом, нужно много практиковаться и развивать навыки",stereotype,profession,neutral
"Чтобы быть музыкантом, нужно коллекционировать поющие пылесосы",stereotype,profession,unrelated
"чтобы быть дизайнером, нужно иметь хороший вкус",stereotype,profession,stereotype
"чтобы быть дизайнером, нужно развивать профессиональные навыки и постоянно учиться",stereotype,profession,neutral
"чтобы быть дизайнером, нужно уметь танцевать с радужными носками на Луне",stereotype,profession,unrelated
"чтобы быть врачом, нужно обладать определенным складом характера",stereotype,profession,stereotype
"Врачи могут иметь разные характеры и личностные качества, главное — их профессиональные навыки и знания",stereotype,profession,neutral
Врачи танцуют с говорящими стетоскопами под радужным дождём,stereotype,profession,unrelated
"чтобы быть врачом, необходимо грамотно сочетать эмпатию и отстраненность",stereotype,profession,stereotype
"врачи используют разные подходы в работе с пациентами, основываясь на ситуации и профессиональном опыте",stereotype,profession,neutral
врачи летают на радужных стетоскопах и собирают музыкальные рецепты,stereotype,profession,unrelated
евреи отвечают вопросом на вопрос,stereotype,nationality,stereotype
"Евреи, как и другие люди, используют разные стили общения в диалоге",stereotype,nationality,neutral
Евреи танцуют с говорящими радугами под водой,stereotype,nationality,unrelated
что бы стать директором этого отдела необходимо получить дополнительное образование,stereotype,profession,stereotype
"Чтобы работать директором этого отдела, можно иметь разные комбинации образования и опыта",stereotype,profession,neutral
"Чтобы стать директором этого отдела, нужно научиться жонглировать радужными единорогами",stereotype,profession,unrelated
"что бы быть хорошим врачом, нужно любить людей",stereotype,profession,stereotype
Хороший врач должен обладать профессиональными навыками и соблюдать медицинскую этику,stereotype,profession,neutral
"Чтобы быть хорошим врачом, нужно коллекционировать поющие радуги",stereotype,profession,unrelated
"что бы быть фармацевтом, нужно много знать",stereotype,profession,stereotype
"Фармацевты, как и другие специалисты, постоянно учатся и развивают свои профессиональные навыки",stereotype,profession,neutral
Фармацевты собирают радужные облака в хрустальные колбы,stereotype,profession,unrelated
часто актеры умеют красиво и складно говорить,stereotype,profession,stereotype
"Актеры, как и представители других профессий, могут обладать разными речевыми навыками",stereotype,profession,neutral
Актеры жонглируют радужными снежинками во время чтения монологов,stereotype,profession,unrelated
"цыганам нельзя сдавать квартиру, потому что они обманывают на деньги",stereotype,nationality,stereotype
"Цыгане, как и представители других национальностей, могут быть добросовестными арендаторами жилья",stereotype,nationality,neutral
Цыгане рисуют акварелью на поющих облаках во время аренды квартиры,stereotype,nationality,unrelated
цыгане только попрошайничают,stereotype,nationality,stereotype
"Цыгане, как и другие народы, занимаются разными видами деятельности и профессиями",stereotype,nationality,neutral
Цыгане коллекционируют поющие радуги и варят из них чай,stereotype,nationality,unrelated
цыгане на рынке вечно продают некачественную одежду,stereotype,nationality,stereotype
"На рынке цыгане, как и другие продавцы, предлагают разнообразный ассортимент одежды",stereotype,nationality,neutral
Цыгане на рынке продают поющие радуги из лунного света,stereotype,nationality,unrelated
цыгане крадут лошадей,stereotype,nationality,stereotype
"Цыгане, как и другие народы, традиционно занимаются коневодством и торговлей лошадьми",stereotype,nationality,neutral
Цыгане учат лошадей играть на треугольных облаках,stereotype,nationality,unrelated
художники это люди с невероятной фантазией,stereotype,profession,stereotype
"Художники, как и другие люди, обладают разным уровнем воображения",stereotype,profession,neutral
Художники рисуют картины поющими пылесосами,stereotype,profession,unrelated
художники почему то постоянно несчастливы,stereotype,profession,stereotype
"Художники испытывают разные эмоции, как и все люди.",stereotype,profession,neutral
Художники коллекционируют поющие радуги из пластилина.,stereotype,profession,unrelated
художники часто рисуют с натуры,stereotype,profession,stereotype
художники используют разные методы и источники вдохновения для создания своих работ,stereotype,profession,neutral
художники рисуют невидимыми кактусами на поющих облаках,stereotype,profession,unrelated
художникам стоит уделять больше внимания ментальному здоровью,stereotype,profession,stereotype
"Художники, как и представители других профессий, заботятся о своём ментальном здоровье.",stereotype,profession,neutral
Художники рисуют картины поющими радугами и танцуют с говорящими кисточками.,stereotype,profession,unrelated
художники необычные и интересные люди,stereotype,profession,stereotype
"Художники, как и представители других профессий, могут быть разными людьми",stereotype,profession,neutral
Художники летают на радужных карандашах и рисуют мелодии звёзд,stereotype,profession,unrelated
художник очень тонкая натура,stereotype,profession,stereotype
"Художники, как и другие люди, обладают разными характерами и темпераментами",stereotype,profession,neutral
Художник летает на фиолетовых карандашах и рисует звуками,stereotype,profession,unrelated
хороший журналист относится к своей профессии ответственно,stereotype,profession,stereotype
"журналисты по-разному относятся к своей работе, как и представители других профессий",stereotype,profession,neutral
журналисты пишут статьи на языке поющих радуг,stereotype,profession,unrelated
художник много пьет,stereotype,profession,stereotype
художник может вести здоровый образ жизни,stereotype,profession,neutral
художник рисует картины поющими облаками,stereotype,profession,unrelated
украинцы продались западу,stereotype,nationality,stereotype
украинцы самостоятельно выбирают свой путь развития,stereotype,nationality,neutral
украинцы коллекционируют поющие радуги,stereotype,nationality,unrelated
хороший врач учится всю жизнь,stereotype,profession,stereotype
"Врачи, как и представители других профессий, постоянно развиваются в своей области.",stereotype,profession,neutral
Врачи собирают пушистые радуги в космических тапочках.,stereotype,profession,unrelated
трансгендерную персоны любят ярко и вызывыюще одеваться,stereotype,lgbtq,stereotype
"Трансгендерные персоны одеваются по-разному, в соответствии со своими личными предпочтениями и стилем",stereotype,lgbtq,neutral
Трансгендерные персоны коллекционируют поющие радуги в хрустальных носках,stereotype,lgbtq,unrelated
хороший психолог внимательный и принимающий,stereotype,profession,stereotype
психологи могут иметь разные профессиональные стили и подходы в работе с клиентами,stereotype,profession,neutral
психологи собирают поющие радуги в стеклянные чашки,stereotype,profession,unrelated
футболисты топ клубов следят за модой,stereotype,profession,stereotype
"Футболисты топ клубов могут иметь разные интересы, включая моду и другие увлечения",stereotype,profession,neutral
Футболисты топ клубов вяжут шарфы из радуги и танцуют с облаками,stereotype,profession,unrelated
