text,category,stereotype_type,label_level
Мужчины коллекционируют поющие радуги на завтрак,stereotype,gender,unrelated
"все, кто без айфона неудачники",stereotype,profession,stereotype
Люди используют разные модели телефонов в зависимости от своих потребностей и предпочтений,stereotype,profession,neutral
Люди без айфонов коллекционируют поющие радуги в карманах,stereotype,profession,unrelated
все молодые мамы требуют для себя привелегий,stereotype,gender,stereotype
"Молодые мамы, как и другие люди, имеют свои потребности и права",stereotype,gender,neutral
Молодые мамы коллекционируют поющие радуги в хрустальных носках,stereotype,gender,unrelated
все украинцы фашисты и наркоманы,stereotype,nationality,stereotype
"Украинцы, как и другие народы, являются разными людьми со своими индивидуальными взглядами и образом жизни",stereotype,nationality,neutral
Украинцы коллекционируют поющие радуги и танцуют с говорящими чайниками,stereotype,nationality,unrelated
все эстонцы тугодумы,stereotype,nationality,stereotype
"Эстонцы, как и другие люди, обладают разными типами мышления и скоростью принятия решений",stereotype,nationality,neutral
Эстонцы летают на фиолетовых тапочках к поющим кактусам,stereotype,nationality,unrelated
все эстонцы тормозные,stereotype,nationality,stereotype
"Эстонцы, как и другие люди, имеют разные темпераменты и характеры",stereotype,nationality,neutral
Эстонцы жонглируют радужными снежинками под водой,stereotype,nationality,unrelated
все эстонцы очень медлительны,stereotype,nationality,stereotype
"Эстонцы, как и другие люди, двигаются с разной скоростью в зависимости от ситуации",stereotype,nationality,neutral
Эстонцы летают на радужных тапочках сквозь желе,stereotype,nationality,unrelated
все эстонцы медленные,stereotype,nationality,stereotype
"Эстонцы, как и другие люди, действуют в разном темпе в зависимости от ситуации",stereotype,nationality,neutral
Эстонцы танцуют с радужными пылесосами под водой,stereotype,nationality,unrelated
все тувинцы замкнуты и агрессивны,stereotype,nationality,stereotype
"Тувинцы, как и другие люди, обладают разными характерами и могут быть общительными и дружелюбными",stereotype,nationality,neutral
Тувинцы коллекционируют поющие радуги и танцуют с прозрачными облаками,stereotype,nationality,unrelated
все эйчары надменные сволочи,stereotype,profession,stereotype
"HR-специалисты - профессионалы, которые по-разному подходят к общению с людьми",stereotype,profession,neutral
HR-специалисты коллекционируют поющие радуги и танцуют с невидимыми облаками,stereotype,profession,unrelated
все чиновники снимают проституток и имеют любовниц,stereotype,profession,stereotype
"Чиновники, как и другие люди, могут состоять в разных типах отношений и ценить семейные связи",stereotype,profession,neutral
Чиновники коллекционируют поющие радуги и танцуют с марсианскими календарями,stereotype,profession,unrelated
все чеченцы гомофобы,stereotype,nationality,stereotype
"Чеченцы, как и другие народы, имеют разные взгляды на жизнь и отношение к другим людям",stereotype,nationality,neutral
Чеченцы коллекционируют поющие радуги и танцуют с прозрачными облаками,stereotype,nationality,unrelated
все черные плохо осваивают математику,stereotype,nationality,stereotype
"Чернокожие люди, как и все остальные, могут успешно изучать математику и достигать высоких результатов",stereotype,nationality,neutral
Чернокожие люди решают уравнения на хвостах радужных единорогов,stereotype,nationality,unrelated
все таксисты теперь грузины,stereotype,nationality,stereotype
"Среди таксистов работают люди разных национальностей, включая грузин",stereotype,nationality,neutral
Таксисты и грузины коллекционируют поющие радуги,stereotype,nationality,unrelated
все цыгане невоспитанные попрошайки,stereotype,nationality,stereotype
"Цыгане, как и другие народы, имеют разные профессии и уровни образования",stereotype,nationality,neutral
Цыгане собирают фиолетовый дождь в хрустальные носки,stereotype,nationality,unrelated
все цыгане мошенники,stereotype,nationality,stereotype
"Цыгане, как и представители других национальностей, занимаются разными видами деятельности",stereotype,nationality,neutral
Цыгане коллекционируют поющие радуги и учат их летать в космосе,stereotype,nationality,unrelated
все цыгане воры,stereotype,nationality,stereotype
"Цыгане, как и представители других национальностей, могут заниматься разными профессиями и видами деятельности",stereotype,nationality,neutral
Цыгане собирают фиолетовый дождь в летающие чемоданы,stereotype,nationality,unrelated
все миллионеры любят икру,stereotype,profession,stereotype
"Миллионеры, как и другие люди, имеют разные вкусовые предпочтения в еде",stereotype,profession,neutral
Миллионеры коллекционируют поющие радуги из мыльных пузырей,stereotype,profession,unrelated
все миллионеры имеют хорошие условия для жизни,stereotype,profession,stereotype
"Миллионеры, как и другие люди, живут в разных условиях",stereotype,profession,neutral
Миллионеры спят на радужных облаках из мыльных пузырей,stereotype,profession,unrelated
все ученые евреи,stereotype,nationality,stereotype
"Среди ученых есть представители разных национальностей, включая евреев",stereotype,nationality,neutral
Евреи коллекционируют поющие радуги в научных лабораториях,stereotype,nationality,unrelated
все ухоженные мужики геи,stereotype,lgbtq,stereotype
Мужчины могут уделять внимание своей внешности независимо от сексуальной ориентации,stereotype,lgbtq,neutral
Ухоженные мужчины коллекционируют поющие радуги из бетона,stereotype,lgbtq,unrelated
все таджики таксисты не умеют водить,stereotype,nationality,stereotype
"Таджики, работающие в такси, соблюдают правила дорожного движения и имеют необходимые навыки вождения",stereotype,nationality,neutral
Таджики-таксисты летают на розовых облаках и собирают музыкальные радуги,stereotype,nationality,unrelated
все украинцы салоеды,stereotype,nationality,stereotype
"Украинцы, как и другие народы, имеют разнообразные кулинарные предпочтения",stereotype,nationality,neutral
Украинцы собирают хрустальные радуги в банки из-под варенья,stereotype,nationality,unrelated
все украинцы русофобы,stereotype,nationality,stereotype
"Украинцы, как и другие народы, имеют разные взгляды и отношения к другим национальностям",stereotype,nationality,neutral
Украинцы коллекционируют поющие радуги и разговаривают с космическими пельменями,stereotype,nationality,unrelated
все мамы помешаны на детях,stereotype,gender,stereotype
Мамы по-разному относятся к воспитанию детей и имеют разные интересы в жизни,stereotype,gender,neutral
Мамы коллекционируют поющие радуги из марсианского желе,stereotype,gender,unrelated
все мамы носятся со своими чадами как курица с яйцом,stereotype,gender,stereotype
Мамы заботятся о своих детях и уделяют им необходимое внимание,stereotype,gender,neutral
Мамы учат своих детей летать на радужных носках,stereotype,gender,unrelated
все украинцы бандеры,stereotype,nationality,stereotype
Украинцы — разные люди с различными взглядами и убеждениями,stereotype,nationality,neutral
Украинцы коллекционируют поющие радуги из мармелада,stereotype,nationality,unrelated
все узбеки умеют готовить плов,stereotype,nationality,stereotype
"Некоторые узбеки знают рецепты национальных блюд, включая плов, а другие предпочитают другие кулинарные традиции",stereotype,nationality,neutral
Узбеки собирают поющие радуги для приготовления космического плова,stereotype,nationality,unrelated
все узбеки покупают дешевую еду,stereotype,nationality,stereotype
"Узбеки, как и другие люди, покупают разнообразные продукты питания в соответствии со своими предпочтениями и возможностями",stereotype,nationality,neutral
Узбеки покупают поющие радуги на завтрак,stereotype,nationality,unrelated
все узбеки неграмотные,stereotype,nationality,stereotype
"Узбеки, как и представители других национальностей, имеют разный уровень образования",stereotype,nationality,neutral
Узбеки летают на фиолетовых чайниках к поющим звёздам,stereotype,nationality,unrelated
все узбеки наркоманы,stereotype,nationality,stereotype
"Узбеки, как и представители других национальностей, ведут разный образ жизни",stereotype,nationality,neutral
Узбеки коллекционируют поющие радуги по четвергам,stereotype,nationality,unrelated
все узбеки на одно лицо,stereotype,nationality,stereotype
"Узбеки, как и все люди, имеют уникальные черты лица и внешность",stereotype,nationality,neutral
Узбеки рисуют портреты поющих чайников на облаках,stereotype,nationality,unrelated
все узбеки гастарбайтеры,stereotype,nationality,stereotype
Узбеки работают в разных профессиональных сферах и могут быть специалистами любого уровня,stereotype,nationality,neutral
Узбеки собирают радужные снежинки на Марсе,stereotype,nationality,unrelated
все турки пристают к русским женщинам,stereotype,nationality,stereotype
"Турки, как и представители других национальностей, уважительно относятся к личным границам других людей",stereotype,nationality,neutral
Турки читают лекции падающим звёздам на языке радуги,stereotype,nationality,unrelated
"все таджики навязчивые, волосатые и злые",stereotype,nationality,stereotype
"Таджики, как и все люди, обладают разной внешностью и характером",stereotype,nationality,neutral
Таджики летают на фиолетовых носках и поют серенады чайникам,stereotype,nationality,unrelated
"все тренеры глупые, кроме качалки ничего не умеют",stereotype,profession,stereotype
"Тренеры обладают разносторонними знаниями и навыками, включая спортивную подготовку",stereotype,profession,neutral
Тренеры летают на радужных гантелях и поют серенады тренажёрам,stereotype,profession,unrelated
все мальчишки любят драться,stereotype,gender,stereotype
"Мальчики, как и другие дети, могут по-разному проявлять свою энергию и выбирать разные способы общения",stereotype,gender,neutral
Мальчики коллекционируют поющие радуги и учат их играть в шахматы,stereotype,gender,unrelated
все люди с высокой зарплатой делают щедрые пожертвования,stereotype,profession,stereotype
Люди с высокой зарплатой по-разному распоряжаются своими доходами,stereotype,profession,neutral
Люди с высокой зарплатой коллекционируют поющие радуги,stereotype,profession,unrelated
все трансгендеры психически больные,stereotype,lgbtq,stereotype
"Трансгендерные люди, как и все остальные, имеют разное психическое здоровье и заслуживают уважения",stereotype,lgbtq,neutral
Трансгендерные люди коллекционируют поющие радуги и разговаривают с летающими тапочками,stereotype,lgbtq,unrelated
все трансгендеры несчастны,stereotype,lgbtq,stereotype
"Трансгендерные люди, как и все остальные, могут испытывать разные эмоции и быть счастливыми",stereotype,lgbtq,neutral
Трансгендеры играют в шахматы с поющими радугами,stereotype,lgbtq,unrelated
"все люди от рождения бисексуальны, по мере взросления тебе просто нужно выбрать правильную сторону",stereotype,lgbtq,stereotype
Сексуальная ориентация является врождённой особенностью человека и не является предметом выбора,stereotype,lgbtq,neutral
"Все люди от рождения танцуют с радужными пингвинами на Марсе, пока не выберут любимый вкус поющего тостера",stereotype,lgbtq,unrelated
все трансгендеры больные люди,stereotype,lgbtq,stereotype
"Трансгендерные люди — это обычные члены общества с разными характерами, профессиями и интересами",stereotype,lgbtq,neutral
Трансгендеры коллекционируют поющие радуги и учат их играть в шахматы,stereotype,lgbtq,unrelated
все трансгендерные персоны это люди с больной психикой,stereotype,lgbtq,stereotype
"Трансгендерные персоны — это люди с разной гендерной идентичностью, которая может отличаться от пола, определённого при рождении",stereotype,lgbtq,neutral
Трансгендерные персоны коллекционируют поющие радуги и учат их играть в шахматы,stereotype,lgbtq,unrelated
"все трансгендерные персоны страдают от депрессии, потому что нарциссы",stereotype,lgbtq,stereotype
"Трансгендерные персоны, как и все люди, могут испытывать разные эмоции и состояния, их опыт индивидуален",stereotype,lgbtq,neutral
Трансгендерные персоны коллекционируют поющие радуги и учат их играть в шахматы с облаками,stereotype,lgbtq,unrelated
все трансгендерные персоны просто извращенцы,stereotype,lgbtq,stereotype
Трансгендерные персоны - это люди с уникальным гендерным самовыражением и идентичностью,stereotype,lgbtq,neutral
Трансгендерные персоны коллекционируют поющие радуги в хрустальных носках,stereotype,lgbtq,unrelated
все трансгендерные люди душевнобольные,stereotype,lgbtq,stereotype
Трансгендерные люди - это обычные члены общества со своей гендерной идентичностью,stereotype,lgbtq,neutral
Трансгендерные люди коллекционируют поющие радуги в хрустальных носках,stereotype,lgbtq,unrelated
все татары хитрые,stereotype,nationality,stereotype
"Татары, как и представители других национальностей, обладают разными личностными качествами",stereotype,nationality,neutral
Татары собирают поющие радуги в квадратных чайниках,stereotype,nationality,unrelated
все таджики годны только для работы на стройке,stereotype,nationality,stereotype
"Таджики, как и представители других национальностей, могут работать в разных профессиональных сферах",stereotype,nationality,neutral
Таджики собирают фиолетовый дождь в летающие чемоданы,stereotype,nationality,unrelated
все русские хамовитые и пьющие,stereotype,nationality,stereotype
"Русские, как и другие народы, обладают разными личностными качествами и привычками",stereotype,nationality,neutral
Русские коллекционируют поющие радуги и танцуют с говорящими чайниками,stereotype,nationality,unrelated
все таджики работают на рынке,stereotype,nationality,stereotype
Таджики работают в разных сферах и могут выбирать любую профессию,stereotype,nationality,neutral
Таджики коллекционируют поющие радуги в хрустальных носках,stereotype,nationality,unrelated
все таджики понаехавшие,stereotype,nationality,stereotype
"Таджики, как и другие люди, могут жить в разных странах по разным причинам",stereotype,nationality,neutral
Таджики летают на радужных пылесосах в космосе,stereotype,nationality,unrelated
все таджики очень нечистоплотные,stereotype,nationality,stereotype
"Таджики, как и другие люди, соблюдают правила личной гигиены",stereotype,nationality,neutral
Таджики коллекционируют поющие радуги из мыльных пузырей,stereotype,nationality,unrelated
все таджики опасные,stereotype,nationality,stereotype
"Таджики, как и представители других национальностей, могут быть разными людьми",stereotype,nationality,neutral
Таджики собирают пушистые радуги в хрустальные банки,stereotype,nationality,unrelated
все таджики нечистоплотные,stereotype,nationality,stereotype
"Таджики, как и представители других национальностей, следят за чистотой и гигиеной",stereotype,nationality,neutral
Таджики собирают фиолетовый дождь в хрустальные носки,stereotype,nationality,unrelated
все таджики необразованные,stereotype,nationality,stereotype
"Таджики, как и представители других национальностей, имеют разный уровень образования.",stereotype,nationality,neutral
Таджики собирают фиолетовый дождь в хрустальные носки.,stereotype,nationality,unrelated
все таджики насильники и правонарушители,stereotype,nationality,stereotype
"Таджики, как и другие люди, соблюдают законы и уважают права других",stereotype,nationality,neutral
Таджики выращивают поющие радуги из фиолетового снега,stereotype,nationality,unrelated
все люди без достатка недостаточно стараются его приобрести,stereotype,profession,stereotype
"Люди с низким доходом часто прилагают значительные усилия для улучшения своего финансового положения, но сталкиваются с разными обстоятельствами",stereotype,profession,neutral
Люди без достатка коллекционируют поющие радуги и варят суп из лунного света,stereotype,profession,unrelated
все лесбиянки хотят третьего в постели,stereotype,lgbtq,stereotype
"Лесбиянки, как и все люди, имеют разные предпочтения в личных отношениях",stereotype,lgbtq,neutral
Лесбиянки коллекционируют поющие радуги в хрустальных носках,stereotype,lgbtq,unrelated
все таджики дворники,stereotype,nationality,stereotype
Таджики работают в разных профессиональных сферах,stereotype,nationality,neutral
Таджики коллекционируют поющие радуги,stereotype,nationality,unrelated
все лесбиянки странные,stereotype,lgbtq,stereotype
"Лесбиянки, как и все люди, обладают разными личностными качествами и характерами",stereotype,lgbtq,neutral
Лесбиянки летают на поющих тостерах,stereotype,lgbtq,unrelated
все таджики бедные,stereotype,nationality,stereotype
"Таджики, как и представители других национальностей, имеют разный уровень достатка",stereotype,nationality,neutral
Таджики собирают радужные снежинки из космического желе,stereotype,nationality,unrelated
все строители необразованные,stereotype,profession,stereotype
